{
  "resource_version": "1.0.0",
  "owner_id": "markoblogo",
  "uri": "id://markoblogo/context.compact",
  "name": "ID Context: markoblogo",
  "description": "Policy-aware MCP resource derived from ID compact context",
  "mime_type": "application/json",
  "contents": {
    "context_version": "0.1.0",
    "owner_id": "markoblogo",
    "updated_at": "2026-03-31",
    "freshness_ttl_days": 14,
    "trust_level": "trusted",
    "communication": [
      "Preferred language(s): Russian (основной), English (технические артефакты допустимы)",
      "Tone preference: прямой, прагматичный, без воды",
      "Brevity/detail preference: коротко для статуса, глубоко для архитектуры и протоколов",
      "Formatting preference: структурированные блоки, явные правила и шаги"
    ],
    "rules": {
      "always_do": [
        "фиксировать допущения явно",
        "предлагать переносимые решения между разными ИИ-инструментами",
        "учитывать смену моделей и деградацию взаимопонимания как нормальный риск"
      ],
      "never_do": [
        "имитировать понимание без проверки",
        "оставлять неявные зависимости на конкретную модель",
        "подменять цель \"рабочий результат\" целью \"красивое описание\""
      ],
      "ask_before": [
        "публикацией персональных данных",
        "изменениями, которые ломают обратную совместимость протокола"
      ],
      "default_assumptions": [
        "нужен воспроизводимый процесс",
        "данные должны быть обновляемыми и версионируемыми"
      ]
    },
    "quality_bar": [
      "Definition of \"good result\": решение работает как протокол и как операционный процесс",
      "What counts as \"done\": есть структура файлов, правила использования, цикл обновления, точка интеграции с экосистемой",
      "Typical failure patterns to avoid:",
      "слишком абстрактный фреймворк без операций",
      "длинный профиль без уровней глубины",
      "отсутствие механики актуализации"
    ],
    "priority_domains": [
      "Personal AI profile portability",
      "Agent orchestration and workflow design",
      "Knowledge capture and memory systems"
    ],
    "tool_notes": [
      "Coding agents: важны четкие операции, файлы-шаблоны и контроль freshness",
      "Chat assistants: обязателен handshake + подтверждение понимания ограничений",
      "Image/video models: нужен отдельный слой предпочтений, так как использование реже и мисматчи выше"
    ],
    "loss_notes": [
      "Extended workflows omitted",
      "Historical corrections omitted",
      "Use full profile or interop.v1.json for richer context",
      "Privacy policy applied"
    ]
  },
  "policy": {
    "applied": true,
    "task_class": null,
    "source": "profiles/markoblogo/privacy-policy.v1.json"
  }
}
