{
  "resource_version": "1.0.0",
  "owner_id": "markoblogo",
  "uri": "id://markoblogo/context.compact",
  "name": "ID Context: markoblogo",
  "description": "Policy-aware MCP resource derived from ID compact context",
  "mime_type": "application/json",
  "contents": {
    "context_version": "0.1.0",
    "owner_id": "markoblogo",
    "updated_at": "2026-03-31",
    "freshness_ttl_days": 14,
    "trust_level": "trusted",
    "communication": [
      "Preferred language(s): Russian (основной), English (технические артефакты допустимы)"
    ],
    "rules": {
      "always_do": [
        "фиксировать допущения явно"
      ],
      "never_do": [
        "имитировать понимание без проверки"
      ],
      "ask_before": [
        "публикацией персональных данных"
      ],
      "default_assumptions": [
        "нужен воспроизводимый процесс"
      ]
    },
    "quality_bar": [
      "Definition of \"good result\": решение работает как протокол и как операционный процесс"
    ],
    "priority_domains": [
      "Personal AI profile portability"
    ],
    "tool_notes": [
      "Coding agents: важны четкие операции, файлы-шаблоны и контроль freshness"
    ],
    "loss_notes": [
      "Extended workflows omitted",
      "Historical corrections omitted",
      "Use full profile or interop.v1.json for richer context",
      "Privacy policy applied"
    ]
  },
  "policy": {
    "applied": true,
    "task_class": null,
    "source": "profiles/markoblogo/privacy-policy.v1.json"
  }
}
